{"registry_version":"official-source-registry-v1","policy_id":"official-devops-tools-v1","topic":"devops-tools","approval_status":"pending","entries":[{"source_id":"one","fact_id":"one","display_name":"Same","verification":"pending_authoritative_verification","allowed_https_domain":null,"allowed_path_prefixes":[],"canonical_official_url":null,"canonical_source_url":null,"redirect_policy":"same_approved_domain_only"},{"source_id":"two","fact_id":"two","display_name":"Same","verification":"pending_authoritative_verification","allowed_https_domain":null,"allowed_path_prefixes":[],"canonical_official_url":null,"canonical_source_url":null,"redirect_policy":"same_approved_domain_only"}]}
